{
  "$schema": "https://json-schema.org/draft/2020-12/schema",
  "$id": "https://pokerapp.local/contracts/hand.schema.json",
  "title": "Hand",
  "version": "1.7",
  "description": "HandSummary.to_dict() の契約（hand core, ADR-0010 R5 + ADR-0008/0009 additive）。ISSUE-0011 の決定により additionalProperties:true で 1.0。required は安定 core キーのみ（additive な pots / player_id / committed 等は optional、legacy/fallback で absent/null 可）。1.1 = board_timeline を optional 追加（ボード各枚の配布時刻。ADR-0055, additive）。1.2 = button_seat / position_map を optional 追加（ディーラーボタン回転。仕様 FR-05b/§6.1, ISSUE-0032, additive）。1.3 (ADR-0050 S7, additive) = split pot の pot_awards を追加（単独勝者ハンドでは absent。verify-v1 系列では 1.1 だったものを 2026-09-22 のマージで統合）。1.4 (ADR-0062, additive) = winner_source（勝者の自動判定の決まり方: fold / cards / estimated。宣言で決めたハンドでは absent）と showdown（ショーダウンを手札で判定したときの各席の役）を optional 追加。pot_awards は手札で判定して 2 人以上に配ったとき（引き分け・side pot の勝者が別）にも入る。1.5 (2026-09-26, additive) = announced_hand（ディーラーが言った勝った役の名前）を optional 追加、winner_source に announced（役名から勝者を決めた = 判定と違う / 手札が読めない席がある, review_required）を追加。1.6 (2026-09-29, additive) = board に読めなかった位置の `??` を入れる（読めた一番後ろの位置まで。フロップの 1 枚が読めずにターンが読めたとき、ターンの札をフロップに詰めない）。winner_source に undetermined（ショーダウンで札が読めず、読めていない札しだいで勝者が変わる = チップを動かさない, winner_seat は null, review_required）を追加し、winner_seat は null も可。1.7 (2026-09-30, additive) = showdown の各席に announced（その席が見せたときにディーラーが言った役名。オーナー: アウトオブポジションから見せ、見せるたびに役名を言う運用）。announced_hand は勝った人に言った役名。",
  "type": "object",
  "additionalProperties": true,
  "required": ["hand_id", "session_id", "started_at", "ended_at", "players", "actions"],
  "properties": {
    "hand_id": {"type": "integer", "minimum": 0},
    "session_id": {"type": "string", "minLength": 1, "description": "ADR-0008: UUID4 hex 推奨, legacy timestamp 文字列も valid"},
    "started_at": {"type": "string"},
    "ended_at": {"type": "string"},
    "blinds": {
      "type": "object",
      "properties": {"sb": {"type": "integer", "minimum": 0}, "bb": {"type": "integer", "minimum": 0},
                     "bb_ante": {"type": "integer", "minimum": 0, "description": "BB アンティ（BB の人が BB と同額のアンティを出したハンドだけ。CLI の `ante on`, 2026-10-19, additive）"}}
    },
    "board": {"type": "array", "items": {"type": "string"}, "description": "ボードの札を位置の順に（1〜3 = フロップ・4 = ターン・5 = リバー）。読めた一番後ろの位置まで。途中の位置が読めなかったときは `??`（1.6。PHH の未知の札と同じ表記）。"},
    "board_source": {"type": "string", "enum": ["rfid", "ocr", "manual", ""]},
    "board_timeline": {
      "type": "array",
      "description": "ボード各枚の**配布時刻**（RFID が最初に検出した時刻）。index 昇順。ターン/リバーの配布時刻はベッティングラウンドの区切りとしてアクションの時刻に対応するため記録する（ADR-0055）。フロップは 3 枚の最小値がラウンド開始で、フロップ内の順序自体は意味を持たない。RFID 以外のソース・時刻未取得では空配列。",
      "items": {
        "type": "object",
        "additionalProperties": true,
        "required": ["index", "card", "dealt_at"],
        "properties": {
          "index": {"type": "integer", "minimum": 1, "maximum": 5},
          "card": {"type": "string", "minLength": 1},
          "dealt_at": {"type": "string", "minLength": 1, "description": "ISO 8601。replay では注入 clock 由来。"}
        }
      }
    },
    "button_seat": {
      "type": ["integer", "null"],
      "minimum": 1, "maximum": 9,
      "description": "このハンドの**ディーラーボタンの席**（仕様 FR-05b）。ハンドごとに 1 つ回る。ボタンを持たない backend（legacy）では null（ISSUE-0032）。"
    },
    "position_map": {
      "type": "object",
      "description": "seat（文字列化した席番号）→ ポジション名（仕様 §6.1）。`button_seat` から決定的に導出する。ボタン未確定なら空オブジェクト（ISSUE-0032）。",
      "additionalProperties": {"enum": ["BTN", "SB", "BB", "UTG", "UTG+1", "UTG+2", "MP", "HJ", "CO"]},
      "propertyNames": {"pattern": "^[1-9]$"}
    },
    "players": {
      "type": "array",
      "items": {
        "type": "object",
        "additionalProperties": true,
        "required": ["seat", "name"],
        "properties": {
          "seat": {"type": "integer", "minimum": 1, "maximum": 9},
          "name": {"type": "string"},
          "player_id": {"type": ["string", "null"], "pattern": "^[0-9a-f]{32}$", "description": "ADR-0008 additive（S2.x 接続後）"},
          "committed": {"type": ["integer", "null"], "minimum": 0, "description": "ADR-0009 additive"}
        }
      }
    },
    "pot_total": {"type": "integer", "minimum": 0},
    "pots": {
      "type": "array",
      "description": "ADR-0009 additive。main/side pot（rules-aware のみ、legacy は []）。",
      "items": {
        "type": "object",
        "required": ["amount", "eligible_seats"],
        "properties": {
          "amount": {"type": "integer", "minimum": 0},
          "eligible_seats": {"type": "array", "items": {"type": "integer", "minimum": 1, "maximum": 9}}
        }
      }
    },
    "winner_seat": {"type": ["integer", "null"], "description": "主勝者（split pot では読み上げ先頭の勝者 = 従来互換, ADR-D）。null = 勝者が分からずチップを動かしていない（winner_source=undetermined, 1.6）"},
    "pot_awards": {
      "type": "array",
      "description": "ADR-D S7 additive。split pot（チョップ）時の授与内訳。ADR-0062 以降はショーダウンを手札で判定して 2 人以上に配ったとき（引き分け・side pot の勝者が別）にも入る。単独勝者ハンドでは absent。",
      "items": {
        "type": "object",
        "required": ["seat", "amount"],
        "properties": {
          "seat": {"type": "integer", "minimum": 1, "maximum": 9},
          "amount": {"type": "integer", "minimum": 0}
        }
      }
    },
    "announced_hand": {"type": "string", "enum": ["High card", "One pair", "Two pair", "Three of a kind", "Straight", "Flush", "Full house", "Four of a kind", "Straight flush"], "description": "1.5 additive。ディーラーがショーダウンで言った勝った役の名前（pokerkit の役名）。言わなければ absent。判定と違えば review_required。"},
    "winner_source": {
      "type": "string",
      "enum": ["fold", "cards", "estimated", "announced", "undetermined"],
      "description": "ADR-0062 additive。勝者を自動で決めたときの決まり方: fold = ほかが全員フォールド（ショーダウンで見せずにマックした人を含む）/ cards = ショーダウンを RFID の手札とボードで判定 / estimated = 決まらないまま次の手札が配られた（仮, review_required）。ディーラーの宣言（w / ウィナー）で決めたハンドでは absent。announced（1.5）= ディーラーの役名と手札の判定が違う、または手札が読めない席があるときに、役名に合う席を勝者にした（review_required）。undetermined（1.6）= ショーダウンで札が読めず、読めていない札しだいで勝者が変わるので、チップを動かさずに終えた（各席に出した額を返した, winner_seat は null, review_required）。cards は読めていない札があってもどの札でも同じ配当になるときを含む（review_required）。"
    },
    "showdown": {
      "type": "array",
      "description": "ADR-0062 additive。ショーダウンを手札で判定したときの、見せた各席の役（手番の順）。winner_source=cards のときだけ。",
      "items": {
        "type": "object",
        "required": ["seat", "hole_cards", "hand", "best"],
        "properties": {
          "seat": {"type": "integer", "minimum": 1, "maximum": 9},
          "hole_cards": {"type": "array", "items": {"type": "string"}, "minItems": 2, "maxItems": 2},
          "hand": {"type": "string", "description": "役名（pokerkit の表記: High card / One pair / Two pair / Three of a kind / Straight / Flush / Full house / Four of a kind / Straight flush）"}, "announced": {"type": "string", "description": "1.7 additive。その席が見せたときにディーラーが言った役名（pokerkit の表記）。言わなかった・聞き取れなかった席は absent。"},
          "best": {"type": "array", "items": {"type": "string"}, "minItems": 5, "maxItems": 5}
        }
      }
    },
    "actions": {"type": "array"},
    "review_required": {"type": "boolean"}
  }
}
