{
  "hand_id": 1,
  "session_id": "fixture-hand-canonical",
  "started_at": "2026-06-05T04:00:00.000",
  "ended_at": "2026-06-05T04:00:10.000",
  "blinds": {"sb": 100, "bb": 200},
  "board": [],
  "board_source": "",
  "players": [
    {"seat": 1, "name": "P1", "hole_cards": null, "hole_cards_source": "", "stack_start": 1000, "stack_end": 100, "result": -900},
    {"seat": 2, "name": "P2", "hole_cards": null, "hole_cards_source": "", "stack_start": 3000, "stack_end": 7200, "result": 4200},
    {"seat": 3, "name": "P3", "hole_cards": null, "hole_cards_source": "", "stack_start": 3000, "stack_end": 0, "result": -3000}
  ],
  "pot_total": 6700,
  "pots": [
    {"amount": 3000, "eligible_seats": [1, 2, 3]},
    {"amount": 4000, "eligible_seats": [2, 3]}
  ],
  "winner_seat": 2,
  "actions": [],
  "review_required": false
}
